{
  "$schema": "https://json-schema.org/draft/2020-12/schema",
  "$id": "https://github.com/HSU-YU-MING/cornhsu-xamlcontrast/blob/main/docs/report.schema.json",
  "title": "XamlContrast --json report, schemaVersion 6",
  "description": "Frozen in 1.0. Every field is always present (null when it has no value, [] or {} when empty). Within 1.x fields are only added, never renamed or removed, and an addition does not change schemaVersion: consumers must ignore fields they do not know. Fields written as an enum are closed sets (a new value is a breaking change); fields described as an open set may gain values in 1.x and consumers must accept values they do not know. A breaking change raises schemaVersion and the major version.",
  "type": "object",
  "required": ["schemaVersion", "toolVersion", "exitCode", "summary", "unresolvedSites", "findings"],
  "properties": {
    "schemaVersion": { "const": 6 },
    "toolVersion": { "type": ["string", "null"], "description": "Tool version without build metadata; null when the report was produced through the library rather than the CLI." },
    "exitCode": { "type": ["integer", "null"], "enum": [0, 1, 3, null], "description": "The audit verdict: 0 pass, 1 pairs below the gate, 3 the result cannot be trusted. An output-file error afterwards still exits 2. Null outside the CLI." },
    "summary": {
      "type": "object",
      "required": ["paletteMode", "paletteDegraded", "paletteDetail", "paletteKeys", "singleTheme", "configLoaded", "thresholds", "failOn", "minCoverage", "strictPalette", "files", "pairs", "coverage", "unresolved", "unresolvedBy", "unknownKeys", "skipped", "deadForeground", "disabledExempt", "parseErrors", "parseErrorFiles", "suppressed", "invalidIgnoreCount", "invalidIgnores", "counts"],
      "properties": {
        "paletteMode": { "type": "string", "description": "Which palette detection path ran. An open set: a 1.x release may add a value (a new detection path), so consumers must accept values they do not know. Current values: `pair`, `csharp`, `single`, `none`." },
        "paletteDegraded": { "type": "boolean", "description": "Palette detection degraded: no palette found (hard-coded colours only) or the themes could not be told apart. --strict-palette turns this into exit 3. false when the config chose mode none." },
        "paletteDetail": { "type": "string", "description": "Human-readable detection description (free text)." },
        "paletteKeys": { "type": "integer", "minimum": 0 },
        "singleTheme": { "type": "boolean" },
        "configLoaded": { "type": "boolean" },
        "thresholds": {
          "type": "object",
          "required": ["normalText", "largeText", "failFactor"],
          "properties": {
            "normalText": { "type": "number" },
            "largeText": { "type": "number" },
            "failFactor": { "type": "number" }
          }
        },
        "failOn": { "type": "string", "description": "The gate in effect (flag > config > default): warn = every pair below AA fails the run; fail = only pairs below the fail line. An open set: a 1.x release may add a gate, so consumers must accept values they do not know. Current values: `warn`, `fail`." },
        "minCoverage": { "type": "number", "minimum": 0, "maximum": 100 },
        "strictPalette": { "type": "boolean" },
        "files": { "type": "integer", "minimum": 0 },
        "pairs": { "type": "integer", "minimum": 0 },
        "coverage": { "type": "number", "minimum": 0, "maximum": 100, "description": "Percentage of pairs resolved, one decimal (half away from zero). The --min-coverage floor compares this same value." },
        "unresolved": { "type": "integer", "minimum": 0 },
        "unresolvedBy": { "type": "object", "additionalProperties": { "type": "integer" }, "propertyNames": { "$ref": "#/$defs/reason" } },
        "unknownKeys": { "type": "object", "additionalProperties": { "type": "integer" } },
        "skipped": { "type": "integer", "minimum": 0 },
        "deadForeground": { "type": "integer", "minimum": 0 },
        "disabledExempt": { "type": "integer", "minimum": 0 },
        "parseErrors": { "type": "integer", "minimum": 0 },
        "parseErrorFiles": { "type": "array", "items": { "type": "string" } },
        "suppressed": { "type": "integer", "minimum": 0 },
        "invalidIgnoreCount": { "type": "integer", "minimum": 0 },
        "invalidIgnores": { "type": "array", "items": { "type": "string" } },
        "counts": {
          "type": "object",
          "required": ["fail", "warn", "ok", "decorative"],
          "properties": {
            "fail": { "type": "integer", "minimum": 0 },
            "warn": { "type": "integer", "minimum": 0 },
            "ok": { "type": "integer", "minimum": 0 },
            "decorative": { "type": "integer", "minimum": 0 }
          }
        }
      }
    },
    "unresolvedSites": {
      "type": "array",
      "items": {
        "type": "object",
        "required": ["file", "line", "reason", "value"],
        "properties": {
          "file": { "type": "string", "description": "Relative to the scanned root, forward slashes." },
          "line": { "type": "integer", "minimum": 0 },
          "reason": { "$ref": "#/$defs/reason" },
          "value": { "type": "string", "description": "The value that blocked resolution: the background's raw value when the background is the problem, the palette key for unknown-palette-key, otherwise the foreground's raw value." }
        }
      }
    },
    "findings": {
      "type": "array",
      "items": {
        "type": "object",
        "required": ["file", "line", "element", "fg", "bg", "ratioDark", "ratioLight", "threshold", "category", "symmetry", "isText", "isLargeText", "fontSize", "theme", "baseline"],
        "properties": {
          "file": { "type": "string" },
          "line": { "type": "integer", "minimum": 0 },
          "element": { "type": "string" },
          "fg": { "type": "string", "description": "The foreground as written in the source (a ' ×<opacity>' suffix when an element opacity applies)." },
          "bg": { "type": "string", "description": "The resolved backdrop: '{Key}', '#RRGGBB', or a composite description." },
          "ratioDark": { "type": ["number", "null"], "description": "Contrast ratio in the dark theme; null when the pair exists in the light theme only (theme is \"light\")." },
          "ratioLight": { "type": ["number", "null"], "description": "Contrast ratio in the light theme; null when the pair exists in the dark theme only (theme is \"dark\")." },
          "threshold": { "type": "number", "description": "0 for decorative elements, largeText or normalText otherwise." },
          "category": { "enum": ["ok", "warn", "fail", "decorative"] },
          "symmetry": { "enum": ["both-low", "dark-fails", "light-fails", "single-theme", null], "description": "Only for fail and warn; null otherwise." },
          "isText": { "type": "boolean" },
          "isLargeText": { "type": "boolean" },
          "fontSize": { "type": ["number", "null"], "description": "FontSize in device-independent pixels as written; null when none is set." },
          "theme": { "type": ["string", "null"], "description": "The one theme this pair exists in (a style in a one-theme dictionary, or a style key resolved per theme); the other theme's ratio is null. null when the pair exists in both. An open set: a 1.x release may add a theme (high contrast, say), so consumers must accept values they do not know. Current values: `dark`, `light`." },
          "baseline": { "enum": ["known", "new", "worsened", null], "description": "With --baseline: the ratchet verdict for pairs the gate blocks; null otherwise." }
        }
      }
    }
  },
  "$defs": {
    "reason": { "type": "string", "description": "Why a pair could not be resolved. An open set: a 1.x release may add a reason (a newly named blind spot), so consumers must accept values they do not know; existing values keep their spelling. Current values: `no-ancestor-background`, `bound-or-gradient`, `unknown-palette-key`, `translucent-uncomposited`, `same-brush-pair`, `over-sibling-content`." }
  }
}
