{
  "schemaVersion": 6,
  "toolVersion": "0.0.0-dev",
  "exitCode": 3,
  "summary": {
    "paletteMode": "none",
    "paletteDegraded": true,
    "paletteDetail": "no palette found (no ResourceDictionary color keys, no C# tuples) \u2014 auditing hardcoded colors only",
    "paletteKeys": 0,
    "singleTheme": true,
    "configLoaded": false,
    "thresholds": {
      "normalText": 4.5,
      "largeText": 3,
      "failFactor": 0.67
    },
    "failOn": "warn",
    "minCoverage": 50,
    "strictPalette": false,
    "files": 5,
    "pairs": 0,
    "coverage": 0,
    "unresolved": 2,
    "unresolvedBy": {
      "no-ancestor-background": 1,
      "translucent-uncomposited": 1
    },
    "unknownKeys": {},
    "skipped": 1,
    "deadForeground": 0,
    "disabledExempt": 0,
    "parseErrors": 0,
    "parseErrorFiles": [],
    "suppressed": 0,
    "invalidIgnoreCount": 0,
    "invalidIgnores": [],
    "counts": {
      "fail": 0,
      "warn": 0,
      "ok": 0,
      "decorative": 0
    }
  },
  "unresolvedSites": [
    {
      "file": "Capture/SelectionOverlayWindow.xaml",
      "line": 18,
      "reason": "no-ancestor-background",
      "value": "#66000000"
    },
    {
      "file": "Capture/SelectionOverlayWindow.xaml",
      "line": 33,
      "reason": "translucent-uncomposited",
      "value": "#CC1E1E1E"
    }
  ],
  "findings": []
}